<?xml version="1.0" encoding="UTF-8"?>
<?xmlns = "http://www.ASRS.com" xmlns:xs="http://www.w3.org/2001/XMLSchema-instance" xs:schemaLocation="feedback.xsd"?>
<commenti>
	<feedback>
		<id>1</id>
		<autore>frossi</autore>
		<immagine>avatar.jpg</immagine>
		<data>2015-05-07</data>
		<corpo>Un servizio eccellente! professionalita' e cortesia a un prezzo vantaggioso</corpo>
	</feedback>
	<feedback>
		<id>2</id>
		<autore>francesco10</autore>
		<immagine>avatar.jpg</immagine>
		<data>2015-05-03</data>
		<corpo>La mia festa di compleanno non poteva risultare piu' spettacolare! grazie!</corpo>
	</feedback>
	<feedback>
		<id>3</id>
		<autore>alessiaT</autore>
		<immagine>avatar.jpg</immagine>
		<data>2015-01-22</data>
		<corpo>Servizio ottimo! anche se con poco preavviso, hanno saputo accontentarmi in tutto! </corpo>
	</feedback>

</commenti>
